{
  "schemaVersion": "0.1",
  "title": "Quick Search — interaction exploration",
  "brief": "Explore structurally different interaction models for a focused iOS search app that helps users search and leave instead of falling into a content feed.",
  "defaults": {
    "viewport": {
      "width": 390,
      "height": 844,
      "scale": 0.72
    }
  },
  "rounds": [
    {
      "number": 1,
      "label": "Round 1 — interaction model",
      "variants": [
        {
          "id": "1A",
          "parent": null,
          "name": "Quiet Canvas",
          "file": "round-1/1A.html",
          "hypothesis": "A nearly chrome-free surface will make search intent and task completion feel immediate.",
          "rationale": "Search occupies the visual center while results stay compact and non-feed-like.",
          "gains": ["low distraction", "clear intent"],
          "sacrifices": ["fewer persistent controls"]
        },
        {
          "id": "1B",
          "parent": null,
          "name": "Thumb Search Dock",
          "file": "round-1/1B.html",
          "hypothesis": "A persistent bottom dock can make repeated one-handed searches faster and keep the action anchored.",
          "rationale": "Results occupy the upper canvas while the search affordance remains in the thumb zone.",
          "gains": ["one-handed reachability", "stable search affordance"],
          "sacrifices": ["less vertical result space"]
        },
        {
          "id": "1C",
          "parent": null,
          "name": "Command Results",
          "file": "round-1/1C.html",
          "hypothesis": "Results framed as actions rather than cards will encourage completion instead of browsing.",
          "rationale": "The result list emphasizes the next action and source destination, with minimal content preview.",
          "gains": ["fast completion", "strong anti-feed posture"],
          "sacrifices": ["less room for exploratory content"]
        }
      ]
    }
  ]
}
